{
  "$schema": "../../../_schema/tokens.schema.json",
  "meta": {
    "id": "clean-editorial",
    "title": "Clean Editorial (пример)",
    "lang": "ru",
    "source_images": [],
    "extracted_at": "2026-06-28",
    "extracted_by": "example reference (hand-authored)",
    "confidence": "high",
    "notes": "Нейтральный пример-референс: тёмный модерн-эдиториал, гротеск-заголовки + serif-курсив в цитатах. Без брендинга. Скопируй и поправь цвета/шрифты под свой стиль — или заведи свой через extract-brand-tokens."
  },
  "canvas": {
    "width": "1080px",
    "height": "1350px",
    "safeArea": { "top": "96px", "right": "84px", "bottom": "120px", "left": "84px" }
  },
  "color": {
    "bg": "#11141b",
    "ink": "#07090d",
    "fg": "#eef1f6",
    "accent": "#6ea8fe",
    "accent2": "#f4a261",
    "positive": "#56d364",
    "muted": "#9aa3b2"
  },
  "typography": {
    "fontFamilies": {
      "display": { "$value": "Playfair Display", "fallback": "Georgia, serif" },
      "serif": { "$value": "Lora", "fallback": "Georgia, serif" },
      "grotesk": { "$value": "Inter", "fallback": "system-ui, sans-serif" },
      "mono": { "$value": "IBM Plex Mono", "fallback": "ui-monospace, monospace" }
    },
    "roles": {
      "eyebrow":  { "family": "mono", "size": "26px", "weight": 500, "tracking": "0.16em", "case": "uppercase", "color": "accent" },
      "kicker":   { "family": "mono", "size": "24px", "weight": 500, "tracking": "0.14em", "case": "uppercase", "color": "accent2" },
      "title":    { "family": "grotesk", "size": "96px", "weight": 800, "lineHeight": "1.06", "color": "fg" },
      "subtitle": { "family": "serif", "size": "42px", "weight": 400, "lineHeight": "1.24", "italic": true, "color": "muted" },
      "body":     { "family": "grotesk", "size": "40px", "weight": 400, "lineHeight": "1.34", "color": "fg" },
      "quote":    { "family": "serif", "size": "60px", "weight": 500, "lineHeight": "1.2", "italic": true, "color": "fg" },
      "listItem": { "family": "grotesk", "size": "38px", "weight": 400, "lineHeight": "1.3", "color": "fg" },
      "cta":      { "family": "grotesk", "size": "78px", "weight": 800, "lineHeight": "1.04", "color": "accent" },
      "pageNum":  { "family": "mono", "size": "22px", "weight": 500, "color": "muted" }
    }
  },
  "layout": {
    "radius": "0px",
    "plaque": { "bg": "accent", "color": "ink", "padX": "14px", "padY": "2px" }
  },
  "imagery": {
    "style": "minimal editorial photography, soft studio light, muted desaturated tones, lots of negative space",
    "promptStyle": "minimal editorial photo, soft studio light, muted desaturated palette, lots of negative space, no text",
    "treatment": { "blendMode": "normal", "opacity": 1 }
  },
  "motifs": []
}
